commit	val_bpb	memory_gb	status	description
baseline	1.094873	11.7	keep	gpu0: baseline DEPTH=8 batch=32 all defaults
001	1.207139	11.7	discard	agent1: Higher Matrix LR 0.04→0.08
exp003	1.258704	16.2	discard	gpu0: depth=9 aspect=57 (model_dim=640, only 117 steps, too slow)
002	1.223299	11.7	discard	agent2: RoPE base frequency 50K (base=50000, much worse)
003	1.333033	11.7	discard	gpu0: warmdown=0.7 (LR drops too early with only 121 concurrent steps)
004	1.242305	11.7	discard	agent1: Embedding LR 0.6→0.8 + Unembedding LR 0.004→0.008
005	1.180672	11.7	discard	agent2: x0_lambda init 0.05 (177 steps concurrent)
006	1.279999	11.7	discard	gpu0: SSSSL window pattern (1.280 vs concurrent avg ~1.2)
007	1.258207	11.7	keep	agent1: Concurrent baseline (no changes, 141 steps with GPU contention)
008	1.208443	11.7	keep	agent2: warmdown 0.3 (156 steps, beats concurrent baseline 1.258)
009	1.362157	11.7	discard	gpu0: lower LRs (matrix=0.02, embed=0.3, unembed=0.002) — too slow to converge
011	1.200689	11.7	discard	agent1: x0_lambda 0.05 + Matrix LR 0.08 (worse than x0_lambda alone)
010	1.239609	11.7	keep	agent2: weight_decay=0.05 on x0_lambda=0.05 base (137 steps, slight improvement over concurrent baseline)
012	1.253045	11.7	discard	gpu0: x0_lambda=0.05 + RoPE base=50K (1.253, no improvement over x0_lambda alone)
014	1.212238	11.7	discard	agent1: x0_lambda 0.05 + warmdown 0.3 (worse than x0_lambda alone 1.181)
013	1.179734	11.7	keep	agent2: x0_lambda=0.05 + matrix_lr=0.08 + RoPE 50K (166 steps, NEW BEST)
017	1.252137	11.7	discard	gpu0: adam_beta1=0.9 on x0_lambda=0.05 base (neutral, 1.252 vs 1.258 concurrent baseline)
015	1.242447	11.7	discard	agent1: x0_lambda 0.05 + softcap 30 (worse than x0_lambda alone)
013b	1.196577	11.7	discard	agent2: best (x0+lr+rope) + warmdown 0.3 (151 steps, worse than best 1.180)
016	1.210936	11.7	discard	gpu0: FINAL_LR_FRAC=0.1 on best (x0+mlr0.08+rope50k), 140 steps, no improvement over best 1.180
